{
  "$schema": "./seed-menu.schema.json",
  "schemaVersion": 1,
  "note": "Development estimates. Replace with recipe-calculated or lab-tested values before launch. Nutrition is per ONE Regular portion.",
  "brand": {
    "name": "Bowl Lab",
    "defaultLocale": "en",
    "locales": [
      "en",
      "es"
    ]
  },
  "location": {
    "name": "Bowl Lab Downtown",
    "currency": "USD",
    "taxMode": "exclusive",
    "taxRateBps": 800,
    "timezone": "America/New_York",
    "allergenRegime": "US9",
    "orderPrefix": "A"
  },
  "portionMultipliers": {
    "light": 0.5,
    "half": 0.5,
    "regular": 1,
    "extra": 1.5,
    "double": 2
  },
  "nutrients": [
    {
      "code": "energy_kcal",
      "name": "Calories",
      "unit": "kcal",
      "dailyValue": 2000
    },
    {
      "code": "protein_g",
      "name": "Protein",
      "unit": "g",
      "dailyValue": 50
    },
    {
      "code": "carbohydrate_g",
      "name": "Total carbohydrate",
      "unit": "g",
      "dailyValue": 275
    },
    {
      "code": "fat_g",
      "name": "Total fat",
      "unit": "g",
      "dailyValue": 78
    },
    {
      "code": "fiber_g",
      "name": "Dietary fiber",
      "unit": "g",
      "dailyValue": 28
    },
    {
      "code": "sugars_g",
      "name": "Total sugars",
      "unit": "g",
      "dailyValue": null
    },
    {
      "code": "added_sugars_g",
      "name": "Added sugars",
      "unit": "g",
      "dailyValue": 50
    },
    {
      "code": "sodium_mg",
      "name": "Sodium",
      "unit": "mg",
      "dailyValue": 2300
    }
  ],
  "ingredients": [
    {
      "id": "white-rice",
      "name": {
        "en": "Jasmine White Rice",
        "es": "Arroz blanco jazmín"
      },
      "color": "#EFE9D8",
      "servingGrams": 150,
      "nutritionPerRegular": {
        "energy_kcal": 195,
        "protein_g": 4,
        "carbohydrate_g": 42,
        "fat_g": 0.5,
        "fiber_g": 0.6,
        "sugars_g": 0,
        "added_sugars_g": 0,
        "sodium_mg": 300
      },
      "nutritionSource": "estimate",
      "allergens": [],
      "dietTags": [
        "vegan",
        "vegetarian",
        "gluten_free",
        "dairy_free"
      ],
      "badges": []
    },
    {
      "id": "brown-rice",
      "name": {
        "en": "Brown Rice",
        "es": "Arroz integral"
      },
      "color": "#B88B5C",
      "servingGrams": 150,
      "nutritionPerRegular": {
        "energy_kcal": 170,
        "protein_g": 4,
        "carbohydrate_g": 35,
        "fat_g": 1.5,
        "fiber_g": 2.7,
        "sugars_g": 0.5,
        "added_sugars_g": 0,
        "sodium_mg": 300
      },
      "nutritionSource": "estimate",
      "allergens": [],
      "dietTags": [
        "vegan",
        "vegetarian",
        "gluten_free",
        "dairy_free"
      ],
      "badges": []
    },
    {
      "id": "quinoa",
      "name": {
        "en": "Quinoa",
        "es": "Quinoa"
      },
      "color": "#D8C182",
      "servingGrams": 150,
      "nutritionPerRegular": {
        "energy_kcal": 180,
        "protein_g": 6.5,
        "carbohydrate_g": 32,
        "fat_g": 3,
        "fiber_g": 4,
        "sugars_g": 1,
        "added_sugars_g": 0,
        "sodium_mg": 250
      },
      "nutritionSource": "estimate",
      "allergens": [],
      "dietTags": [
        "vegan",
        "vegetarian",
        "gluten_free",
        "dairy_free"
      ],
      "badges": []
    },
    {
      "id": "greens",
      "name": {
        "en": "Mixed Greens",
        "es": "Hojas verdes mixtas"
      },
      "color": "#5E9F45",
      "servingGrams": 75,
      "nutritionPerRegular": {
        "energy_kcal": 15,
        "protein_g": 1,
        "carbohydrate_g": 3,
        "fat_g": 0,
        "fiber_g": 1.5,
        "sugars_g": 1,
        "added_sugars_g": 0,
        "sodium_mg": 25
      },
      "nutritionSource": "estimate",
      "allergens": [],
      "dietTags": [
        "vegan",
        "vegetarian",
        "gluten_free",
        "dairy_free"
      ],
      "badges": []
    },
    {
      "id": "cauli-rice",
      "name": {
        "en": "Cauliflower Rice",
        "es": "Arroz de coliflor"
      },
      "color": "#E4E1D2",
      "servingGrams": 150,
      "nutritionPerRegular": {
        "energy_kcal": 40,
        "protein_g": 3,
        "carbohydrate_g": 7,
        "fat_g": 0.5,
        "fiber_g": 3,
        "sugars_g": 2,
        "added_sugars_g": 0,
        "sodium_mg": 200
      },
      "nutritionSource": "estimate",
      "allergens": [],
      "dietTags": [
        "vegan",
        "vegetarian",
        "gluten_free",
        "dairy_free"
      ],
      "badges": [
        "low_carb"
      ]
    },
    {
      "id": "grilled-chicken",
      "name": {
        "en": "Grilled Chicken",
        "es": "Pollo a la parrilla"
      },
      "color": "#D49A5C",
      "servingGrams": 113,
      "nutritionPerRegular": {
        "energy_kcal": 190,
        "protein_g": 35,
        "carbohydrate_g": 0,
        "fat_g": 4.5,
        "fiber_g": 0,
        "sugars_g": 0,
        "added_sugars_g": 0,
        "sodium_mg": 380
      },
      "nutritionSource": "estimate",
      "allergens": [],
      "dietTags": [
        "gluten_free",
        "dairy_free"
      ],
      "badges": [
        "high_protein"
      ]
    },
    {
      "id": "grilled-steak",
      "name": {
        "en": "Grilled Steak",
        "es": "Res a la parrilla"
      },
      "color": "#87463A",
      "servingGrams": 113,
      "nutritionPerRegular": {
        "energy_kcal": 230,
        "protein_g": 32,
        "carbohydrate_g": 0,
        "fat_g": 11,
        "fiber_g": 0,
        "sugars_g": 0,
        "added_sugars_g": 0,
        "sodium_mg": 400
      },
      "nutritionSource": "estimate",
      "allergens": [],
      "dietTags": [
        "gluten_free",
        "dairy_free"
      ],
      "badges": [
        "high_protein"
      ]
    },
    {
      "id": "roasted-salmon",
      "name": {
        "en": "Roasted Salmon",
        "es": "Salmón asado"
      },
      "color": "#EE8763",
      "servingGrams": 113,
      "nutritionPerRegular": {
        "energy_kcal": 235,
        "protein_g": 25,
        "carbohydrate_g": 0,
        "fat_g": 15,
        "fiber_g": 0,
        "sugars_g": 0,
        "added_sugars_g": 0,
        "sodium_mg": 300
      },
      "nutritionSource": "estimate",
      "allergens": [
        "fish"
      ],
      "dietTags": [
        "gluten_free",
        "dairy_free"
      ],
      "badges": []
    },
    {
      "id": "garlic-shrimp",
      "name": {
        "en": "Garlic Shrimp",
        "es": "Camarones al ajo"
      },
      "color": "#F3A58C",
      "servingGrams": 113,
      "nutritionPerRegular": {
        "energy_kcal": 135,
        "protein_g": 26,
        "carbohydrate_g": 1,
        "fat_g": 3,
        "fiber_g": 0,
        "sugars_g": 0,
        "added_sugars_g": 0,
        "sodium_mg": 450
      },
      "nutritionSource": "estimate",
      "allergens": [
        "shellfish"
      ],
      "dietTags": [
        "gluten_free",
        "dairy_free"
      ],
      "badges": []
    },
    {
      "id": "baked-tofu",
      "name": {
        "en": "Baked Tofu",
        "es": "Tofu horneado"
      },
      "color": "#E6D39C",
      "servingGrams": 113,
      "nutritionPerRegular": {
        "energy_kcal": 170,
        "protein_g": 18,
        "carbohydrate_g": 4,
        "fat_g": 10,
        "fiber_g": 1,
        "sugars_g": 1,
        "added_sugars_g": 0,
        "sodium_mg": 350
      },
      "nutritionSource": "estimate",
      "allergens": [
        "soy"
      ],
      "dietTags": [
        "vegan",
        "vegetarian",
        "gluten_free",
        "dairy_free"
      ],
      "badges": []
    },
    {
      "id": "no-protein",
      "name": {
        "en": "No Protein (Veggie Bowl)",
        "es": "Sin proteína (bowl vegetal)"
      },
      "color": "#C9D3C2",
      "servingGrams": 0,
      "nutritionPerRegular": {
        "energy_kcal": 0,
        "protein_g": 0,
        "carbohydrate_g": 0,
        "fat_g": 0,
        "fiber_g": 0,
        "sugars_g": 0,
        "added_sugars_g": 0,
        "sodium_mg": 0
      },
      "nutritionSource": "estimate",
      "allergens": [],
      "dietTags": [
        "vegan",
        "vegetarian",
        "gluten_free",
        "dairy_free"
      ],
      "badges": []
    },
    {
      "id": "roasted-broccoli",
      "name": {
        "en": "Roasted Broccoli",
        "es": "Brócoli asado"
      },
      "color": "#3D8A37",
      "servingGrams": 60,
      "nutritionPerRegular": {
        "energy_kcal": 40,
        "protein_g": 2,
        "carbohydrate_g": 4,
        "fat_g": 2,
        "fiber_g": 1.5,
        "sugars_g": 1,
        "added_sugars_g": 0,
        "sodium_mg": 120
      },
      "nutritionSource": "estimate",
      "allergens": [],
      "dietTags": [
        "vegan",
        "vegetarian",
        "gluten_free",
        "dairy_free"
      ],
      "badges": []
    },
    {
      "id": "charred-corn",
      "name": {
        "en": "Charred Corn",
        "es": "Maíz asado"
      },
      "color": "#F0BF2C",
      "servingGrams": 50,
      "nutritionPerRegular": {
        "energy_kcal": 50,
        "protein_g": 1.5,
        "carbohydrate_g": 10,
        "fat_g": 0.5,
        "fiber_g": 1,
        "sugars_g": 3,
        "added_sugars_g": 0,
        "sodium_mg": 120
      },
      "nutritionSource": "estimate",
      "allergens": [],
      "dietTags": [
        "vegan",
        "vegetarian",
        "gluten_free",
        "dairy_free"
      ],
      "badges": []
    },
    {
      "id": "black-beans",
      "name": {
        "en": "Black Beans",
        "es": "Frijoles negros"
      },
      "color": "#2D2933",
      "servingGrams": 60,
      "nutritionPerRegular": {
        "energy_kcal": 80,
        "protein_g": 5,
        "carbohydrate_g": 14,
        "fat_g": 0.5,
        "fiber_g": 5,
        "sugars_g": 0.5,
        "added_sugars_g": 0,
        "sodium_mg": 200